EID,Title,URL
746841182,"The one big thing driving some Republicans to back Harris","https://news-assets.apple.com/podcast/audio/672b62ff-8f31-4d08-8f3e-238308143fed/ANT-20241022v1.mp3"
746534750,"What early voting can and can’t tell us","https://news-assets.apple.com/podcast/audio/48f6bb3c-a807-4729-e7bc-6b9b005dde56/ANT-20241021v2.mp3"
745873419,"One state. Dueling abortion measures. Many confused voters.","https://news-assets.apple.com/podcast/audio/412ad9a1-9d7a-47b3-daa9-0730a9981726/ANT-20241018v3.mp3"
745577643,"Evidence points to his innocence. Texas plans to kill him.","https://news-assets.apple.com/podcast/audio/49e8dbf3-f8c8-440e-e07c-557bf01f5aea/ANT-20241017v3.mp3"
745234802,"Unpacking Trump’s bizarre town hall","https://news-assets.apple.com/podcast/audio/a6dc0624-ce86-461d-fb22-c707b7d9115e/ANT-20241016v1.mp3"
744935831,"The surprising industry scaring politicians — and winning elections","https://news-assets.apple.com/podcast/audio/e4121e39-2b43-4745-ebc3-f4f136c8e5de/ANT-20241015v2.mp3"
744658802,"What was flying in the skies during Sunday football","https://news-assets.apple.com/podcast/audio/419af66e-5f9b-420b-d890-856c0318ca43/ANT-20241014-v1.mp3"
743874958,"Why presidential candidates are all over your podcast feeds","https://news-assets.apple.com/podcast/audio/fc9b7888-d089-4ac2-a4cc-366ea97bc237/ANT-20241011v1.mp3"
743390948,"The Pennsylvania county that could swing the election","https://news-assets.apple.com/podcast/audio/c4cbf645-6232-4d7e-c133-dc8d5299c89a/ANT-20241010v3.mp3"
743135178,"The presidential race is tight. What can polls tell us?","https://news-assets.apple.com/podcast/audio/05fe37a2-13b2-4017-d18f-f56859a82fd1/ANT-20241009v1.mp3"
742843028,"How private equity transformed U.S. emergency rooms","https://news-assets.apple.com/podcast/audio/4b6bfef7-9e25-449b-9dae-c480d855cd8d/ANT-20241008v1.mp3"
742517119,"What the election could mean for Israel’s war in Gaza","https://news-assets.apple.com/podcast/audio/78eb26f3-1cdb-4922-9e50-b3d05d5fb9e2/ANT-20241007v2.mp3"
741864645,"Who gets the dog in a divorce?","https://news-assets.apple.com/podcast/audio/94e70a4c-5ebd-48cc-9a64-67f5dbb88fab/ANT-20241004v1.mp3"
741656236,"The dark truth about China’s adoption program","https://news-assets.apple.com/podcast/audio/165a3f55-1150-4765-8312-d0c57fb3bc69/ANT-20241003v2.mp3"
741343354,"The big takeaways from the vice-presidential debate","https://news-assets.apple.com/podcast/audio/285d6467-1858-4861-f57f-cf7e27c2fb66/ANT-20241002v4.mp3"
741147808,"Helene is gone, but North Carolina’s nightmare isn’t over","https://news-assets.apple.com/podcast/audio/32a6e102-0ed3-4bfc-aa82-15d59adeeceb/ANT-20241001v1.mp3"
740928591,"Millions are in crisis after Hurricane Helene","https://news-assets.apple.com/podcast/audio/518fd468-05f4-4695-9ca8-ff216d9d9473/ANT-20240930v1.mp3"
740408675,"New York City's mayor was indicted. What's next?","https://news-assets.apple.com/podcast/audio/cddb8353-6112-47ad-8324-6f8cf42582ac/ANT-20240927v1.mp3"
740118538,"Why a jury spared the Parkland school shooter’s life","https://news-assets.apple.com/podcast/audio/3c7b5aad-144d-48e0-a246-a3dd8a43a521/ANT-20240926v3.mp3"
739770882,"Beyond “freak offs”: a deeper look at the Diddy allegations","https://news-assets.apple.com/podcast/audio/2a52f028-34e3-4b60-a962-6b7235bda98f/ANT-20240925v2.mp3"
739448674,"How a GOP scandal could impact Trump","https://news-assets.apple.com/podcast/audio/41a088d7-e8b8-4096-e780-da76e5d0e05b/ANT-20240924v1.mp3"
739205115,"Their bodies were sold for research. Families didn’t know.","https://news-assets.apple.com/podcast/audio/19e88af1-2d52-4432-9669-482a53299dc4/ANT-20240923v1.mp3"
738561133,"Overdose deaths are plummeting. Scientists aren’t sure why.","https://news-assets.apple.com/podcast/audio/63fbda27-c570-4ec5-934c-cbb9a7c9df33/ANT-20240920v1.mp3"
738219953,"The Fed just cut rates. Here’s what that means for you.","https://news-assets.apple.com/podcast/audio/cbd4b1b1-2d29-40fe-f48e-8d3c8c88ac85/ANT-20240919v2.mp3"
737942061,"The future of Fox News hinges on a bitter family feud","https://news-assets.apple.com/podcast/audio/97557fdf-9c23-4742-d7cc-c966e6e55a83/ANT-20240918v2.mp3"
737666759,"How did a gunman get so close to Trump — again?","https://news-assets.apple.com/podcast/audio/3aa06e9a-ac2b-4ff0-c633-458456c530eb/ANT-20240917v2.mp3"
737426619,"Another gunman caught near Trump. What to know.","https://news-assets.apple.com/podcast/audio/e6660056-b750-4cac-abbf-5e4fb04349ef/ANT-20240916v2.mp3"
736749422,"Thanks to COVID, more Americans are single","https://news-assets.apple.com/podcast/audio/80f3cc78-ac9c-4d93-dcd6-06bfff386b9e/ANT-20240913v1.mp3"
736407616,"It may soon be legal to bet on elections. Is America ready?","https://news-assets.apple.com/podcast/audio/6ce84d19-46b1-4a31-dabc-8bb728b01fdb/ANT-20240912v2.mp3"
736093064,"The big moments from the Harris-Trump debate","https://news-assets.apple.com/podcast/audio/495df067-b7d7-44bb-ee06-2b789eaecfb6/ANT-20240911v2.mp3"
735848976,"What to look for as Harris and Trump square off","https://news-assets.apple.com/podcast/audio/321cdd9d-0368-4756-9b56-a555272fb97e/ANT-20240910v3.mp3"
735548247,"Harris is outraising Trump. Will it matter?","https://news-assets.apple.com/podcast/audio/3847af5e-a563-4792-c538-0be9b1c74bf7/ANT-20240909v1.mp3"
734844414,"How modern marijuana became so potent","https://news-assets.apple.com/podcast/audio/6a249b16-024f-4447-9396-5d4e115c0684/ANT-20240906v1.mp3"
734496893,"Inside foreign efforts to sow chaos in the 2024 election","https://news-assets.apple.com/podcast/audio/9b2ecded-68e2-4945-ea08-cf28fcaebea1/ANT-20240905v1.mp3"
734168316,"The Florida Republicans who want to protect abortion","https://news-assets.apple.com/podcast/audio/b4a67afa-9de5-4d93-b020-313216df3740/ANT-20240904v1.mp3"
733778617,"Union members could decide this election. Here’s how.","https://news-assets.apple.com/podcast/audio/ec3fa2f9-5a91-4674-e1c6-dd7db9864a36/ANT-20240903v1.mp3"
732330314,"How your tax bill might change under Harris or Trump","https://news-assets.apple.com/podcast/audio/1de11170-efac-4e4a-ddd8-af5677947beb/ANT-20240830v2-POD.mp3"
731963662,"10 races that could flip the Senate in 2024","https://news-assets.apple.com/podcast/audio/ef2d4472-20b0-47ec-827d-47e54acf4727/ANT-20240829v1.mp3"
731665024,"GOP officials are preparing to contest the election results","https://news-assets.apple.com/podcast/audio/c43ca5e6-9f35-4846-d498-5d222f066d98/ANT-20240828v1.mp3"
731339245,"Could a big merger drive grocery prices even higher?","https://news-assets.apple.com/podcast/audio/971c0345-e38d-4f85-efc1-c0340f937427/ANT-20240827v2.mp3"
731065046,"Why reality TV is about to change","https://news-assets.apple.com/podcast/audio/22bd3a86-19a7-496b-ba45-ff887053b667/ANT-20240826v1.mp3"
730368358,"What Harris did — and didn’t — say in her big speech","https://news-assets.apple.com/podcast/audio/26a0e84f-3901-4a12-90f1-df1ca23507f5/ANT-20240823v1.mp3"
730046104,"Are voters ready to elect a woman president?","https://news-assets.apple.com/podcast/audio/c0276f5e-1ed0-489c-8dda-1c57d1d2eabd/ANT-20240822v2.mp3"
729760776,"Harris brings out the Obamas to take on Trump","https://news-assets.apple.com/podcast/audio/a3d09180-48c9-4439-98da-dbc54357b723/ANT-20240821v1.mp3"
729477740,"Biden passes torch to Harris in generational shift","https://news-assets.apple.com/podcast/audio/4541b42d-4f8a-4362-cdce-0570a08ea205/ANT-20240820v3.mp3"
729137327,"How protests are affecting the Democratic convention","https://news-assets.apple.com/podcast/audio/bad3bed3-f4df-42fa-83cc-a455542fbe08/ANT-20240819v1.mp3"
728359381,"Harris and Trump pitch their economic plans","https://news-assets.apple.com/podcast/audio/eb1f3c51-9a42-43dc-e068-638d87ecb32b/ANT-20240816v2.mp3"
727987794,"Secret Project 2025 videos sketch plan for second Trump term","https://news-assets.apple.com/podcast/audio/d23fc0c7-6de8-4a74-dd1b-8a51f21920f8/ANT-20240815v2-POD.mp3"
727619252,"Maui is in trouble. It’s a great time to go.","https://news-assets.apple.com/podcast/audio/139afc5a-44f4-40c4-c868-ea6b790b6c48/ANT-20240814v1.mp3"
727344687,"Tim Walz owns no stock. How his finances make him a political outlier.","https://news-assets.apple.com/podcast/audio/0a5dbcfc-e660-4710-e348-b2459f2f7631/ANT-20240813v2-POD.mp3"
569229361,"Inside the urgent search for earthquake survivors","https://news-assets.apple.com/podcast/audio/6a761b48-6546-43e9-b429-63a6948cfb4f/ANT-20230207v3.mp3"
568912092,"Why the China balloon spying story isn’t over","https://news-assets.apple.com/podcast/audio/c1267a41-cecc-4f64-e40b-0a1ee13b7a69/ANT-20230206v3.mp3"
568056309,"Why we’re all implicated in the “shoplifting epidemic”","https://news-assets.apple.com/podcast/audio/9ccb752e-d027-44fe-b975-fc679e1d160c/ANT-20230203v4.mp3"
567788699,"Inside the GOP’s struggle to move past Trump","https://news-assets.apple.com/podcast/audio/cff52d23-5bb0-4af6-8a68-ec229005d28c/ANT-20230202v2.mp3"
567447586,"How to stop violent crime before police arrive","https://news-assets.apple.com/podcast/audio/d0c572f0-e625-4ecb-83dc-b287e1c130f8/ANT-20230201v3.mp3"
567116270,"Why Florida’s governor wants an AP course banned","https://news-assets.apple.com/podcast/audio/8ddfd1cc-8eb4-4b6e-e9fc-d929779e7879/ANT-20230131v1.mp3"
566855067,"New calls for change after Tyre Nichols’s killing","https://news-assets.apple.com/podcast/audio/72643e27-dfbc-42a2-a69b-3dd972f5f210/ANT-20230130v2.mp3"
566182095,"Former officers face murder charges in Tyre Nichols’s death","https://news-assets.apple.com/podcast/audio/1e1e53e9-6c4d-448d-fbc4-650819597bb8/ANT-20230127v2.mp3"
565907699,"The bill that could boost starting teacher salaries to $60K","https://news-assets.apple.com/podcast/audio/a4f97b7e-a6f2-4407-8624-80c147edc9ca/ANT-20220126v1.mp3"
565554579,"Reconsidering gun laws after California’s mass shootings","https://news-assets.apple.com/podcast/audio/b9943fae-7767-4099-fe6c-09ff4a9df231/ANT-20230125v1-A.mp3"
565236176,"Deadly shootings shock Asian American communities","https://news-assets.apple.com/podcast/audio/dd3b57db-2749-4781-92c6-106da8fcd17e/ANT-20230124v1.mp3"
564964464,"New details in the deadly California mass shooting","https://news-assets.apple.com/podcast/audio/16f17df8-c083-43d3-f54f-e6e98324fd32/ANT-20230123v4.mp3"
564307231,"The charges Alec Baldwin faces over the ‘Rust’ shooting","https://news-assets.apple.com/podcast/audio/7e449948-d5b9-4d0c-b1c9-e4e81449c6c3/ANT-20230120v3.mp3"
564052095,"Understanding the debt-ceiling stalemate in Congress","https://news-assets.apple.com/podcast/audio/6fccb1ac-4d9e-46c2-86aa-1e5de2a91e6f/ANT-20230119v2.mp3"
563764491,"New details on former GOP candidate accused of shootings","https://news-assets.apple.com/podcast/audio/3ae3e0ba-3c8a-44bc-8c8c-bc1b696c14c3/ANT-20230118v2.mp3"
563484543,"Why Elon Musk is in court over tweets","https://news-assets.apple.com/podcast/audio/81ab0855-38a0-43a5-b609-465909a1c768/ANT-20230117v3.mp3"
563220406,"Why Western tanks could transform the war in Ukraine","https://news-assets.apple.com/podcast/audio/fd686900-acbb-487c-b70d-e3cc777dede5/ANT-20230116v1.mp3"
562577424,"Why you’re hearing so much about gas stoves right now","https://news-assets.apple.com/podcast/audio/843faa3a-ada1-45c8-b7ee-f6d0dcd0bb24/ANT-20230113v1.mp3"
562305031,"Who’s accountable when a 6-year-old shoots a teacher?","https://news-assets.apple.com/podcast/audio/e01370b5-cfe1-4a5b-db3b-c1a84c77758c/ANT-20230112v2.mp3"
561917040,"California braces for more deadly storms","https://news-assets.apple.com/podcast/audio/c7f05576-77ee-43c9-8db8-477b351bcec2/ANT-20230111v6.mp3"
561648662,"What to know about Biden’s new immigration moves","https://news-assets.apple.com/podcast/audio/e8ed0190-0d1f-4bef-e94f-71ea2cac3b37/ANT-20230110v2.mp3"
561362301,"How Trump and allies are connected to Brazil’s unrest","https://news-assets.apple.com/podcast/audio/052bb2a1-2fb8-49c4-8641-386b97cff3fa/ANT-20230109v3.mp3"
560754616,"How the historic House-speaker stalemate could end","https://news-assets.apple.com/podcast/audio/786671e2-1fe9-4899-c055-a4d04e2f4ce1/ANT-20230106v2.mp3"
560493793,"Damar Hamlin’s collapse tests NFL’s mental-health commitment","https://news-assets.apple.com/podcast/audio/8ff232c7-b979-40c8-ebfc-2950c26f1edf/ANT-20230105v4.mp3"
560211809,"Why the House still has no speaker — and what happens next","https://news-assets.apple.com/podcast/audio/88d985d1-86f9-48fd-c3a8-a08c17037bf5/ANT-20230104v2.mp3"
559932102,"Inside Kevin McCarthy’s scramble to win House speaker","https://news-assets.apple.com/podcast/audio/8dd7229d-a710-4ccf-93fa-cd0c978dc0ec/ANT-20230103v3.mp3"
557808479,"How Congress is overhauling retirement-saving rules","https://news-assets.apple.com/podcast/audio/211da45d-8109-4a68-aa98-018c46c57bc6/ANT-20221223v2.mp3"
557586409,"The Arctic blast pummeling the U.S.","https://news-assets.apple.com/podcast/audio/d756bce1-180c-43b5-dc21-cc5cc9bdf9eb/ANT-20221222v1.mp3"
557281728,"As Zelenskyy meets Biden, a look at a key Ukraine battle","https://news-assets.apple.com/podcast/audio/5decbe9d-3f18-4005-fc05-7356cb323bea/ANT-20221221v1.mp3"
557007970,"What’s next for immigration after a big Supreme Court move","https://news-assets.apple.com/podcast/audio/027737c9-558d-4c3e-c696-1a2757635b5e/ANT-20221220v3.mp3"
556752066,"A World Cup final that lived up to the hype","https://news-assets.apple.com/podcast/audio/e0d5664e-21ec-4daf-f1e0-7831536c24a3/ANT-20221219v2.mp3"
556155842,"What microplastics are and why you should worry","https://news-assets.apple.com/podcast/audio/66694f18-8944-4c3f-dc05-77a0dd899e7e/ANT-20221216v1.mp3"
555929380,"More severe weather expected after deadly tornadoes","https://news-assets.apple.com/podcast/audio/d14926f9-6964-4fed-f054-d0781517acb9/ANT-20221215v1.mp3"
555597499,"How Washington’s failures exacerbated the fentanyl crisis","https://news-assets.apple.com/podcast/audio/0ba64600-a2b4-45b0-872a-36175345b306/ANT-20221214v1.mp3"
555310891,"FTX founder charged with defrauding investors","https://news-assets.apple.com/podcast/audio/4de612fd-4ed3-4e6a-aa73-82189f64b230/ANT-20221213v4.mp3"
555036738,"New drone strikes reveal growing Russia–Iran military ties","https://news-assets.apple.com/podcast/audio/a3e35315-e45c-4bfb-f447-b741205c4b0c/ANT-20221212v1.mp3"
554401945,"Iran escalates plots to kidnap, assassinate critics","https://news-assets.apple.com/podcast/audio/9cf3c802-b5e0-4c9e-a985-5e581c46033c/ANT-20221209v3.mp3"
554110023,"WNBA star Brittney Griner freed in prisoner swap","https://news-assets.apple.com/podcast/audio/9e2b3b83-8a94-4c02-b2ae-d7a4ebf2cb94/ANT-20221208v2.mp3"
553770981,"What Raphael Warnock’s win means for the Senate and Georgia","https://news-assets.apple.com/podcast/audio/674e24f2-3c37-4aba-b7b8-80e8025a8067/ANT-20221207v1.mp3"
553488165,"Georgia voters pick their next senator: Warnock or Walker","https://news-assets.apple.com/podcast/audio/dd1b31d0-a222-4752-ca7d-4a67de0b865b/ANT-20221206v1.mp3"
553213163,"Iran official’s claims of change spark hope, skepticism","https://news-assets.apple.com/podcast/audio/16da843d-a13d-4333-902a-93219ec4f8c8/ANT-20221205v1.mp3"
552564735,"Why Biden’s student-loan relief plan is in danger again","https://news-assets.apple.com/podcast/audio/be8c4c22-d5e2-462d-8843-aa5122c2350d/ANT-20221202v1.mp3"
552308225,"Why Biden asked Congress to stop a rail strike","https://news-assets.apple.com/podcast/audio/16e5158f-ea8d-4632-fa4a-c62a4e3c8e02/ANT-20221201v1.mp3"
552008741,"What the Oath Keepers guilty verdict means for Jan. 6 cases","https://news-assets.apple.com/podcast/audio/59a1ec50-2ac9-4bb6-d2d4-089158297cbd/ANT-20221130v2.mp3"
551703228,"The U.S. faces Iran in a politically charged World Cup game","https://news-assets.apple.com/podcast/audio/cb14e057-fa80-4951-dab5-52b50fa96b17/ANT-20221129v1.mp3"
551438303,"Why the Georgia Senate runoff matters","https://news-assets.apple.com/podcast/audio/410f9da7-9f41-49e1-f339-9aeec653d802/ANT-20221128v1.mp3"
549091673,"A look ahead at a divided Washington","https://news-assets.apple.com/podcast/audio/b95afb8c-a373-4331-817d-2d0cae57e95e/ANT-20221118v2.mp3"
548717517,"What Dems want done in their last weeks with House control","https://news-assets.apple.com/podcast/audio/66ea64a5-f24e-4f44-c162-40d05aae0b27/ANT-20221117v2.mp3"
548412314,"He’s running. What next for investigations into Trump?","https://news-assets.apple.com/podcast/audio/13b41d6e-b1db-49d4-8418-f89a91013102/ANT-20221116v3.mp3"
548112723,"Why abortion-rights activists are taking the fight to states","https://news-assets.apple.com/podcast/audio/c32a3f17-cade-44aa-8fc4-e75a5e305f98/ANT-20221115v3.mp3"
547814168,"After disappointing midterms, new GOP criticism of Trump","https://news-assets.apple.com/podcast/audio/6f688087-12ee-4f0c-b913-306f429ca0ea/ANT-20221114v3.mp3"
547261483,"How strong youth turnout affected the midterms","https://news-assets.apple.com/podcast/audio/6694185c-ce41-4b49-f221-e104be20baa0/ANT-20221111v2.mp3"
547019088,"The latest election news, as Georgia heads for a runoff","https://news-assets.apple.com/podcast/audio/4061267e-c735-46a8-9fbe-a0bd78e26aa1/ANT-20221110v1.mp3"
546721092,"Where we stand after an unusual election night","https://news-assets.apple.com/podcast/audio/e63e76c7-5a09-40a9-f5eb-9e4b824fbb6e/ANT-20221109v4.mp3"
546446925,"Republicans are already suing over mail-in ballots","https://news-assets.apple.com/podcast/audio/34088aac-d3f4-4a98-d147-bf54f6babb6c/ANT-20221108v2.mp3"
546191391,"Closing arguments in the midterm campaigns","https://news-assets.apple.com/podcast/audio/2d2b0059-1b95-4428-c678-ca4a21321cb5/ANT-20221107v2.mp3"
545560140,"After mass layoffs at Twitter, what will Elon Musk do next?","https://news-assets.apple.com/podcast/audio/4f0095e0-cfae-48a8-f18a-3b82845927eb/ANT-20221104v2.mp3"
545622117,"Which party will control Congress? Three experts weigh in.","https://news-assets.apple.com/podcast/audio/9d91987a-7f88-41a4-94b1-a897ae97d242/MID-20221108v6.mp3"
545301010,"Biden wants lower gas prices. Here’s why it won’t be easy.","https://news-assets.apple.com/podcast/audio/f9e6264a-992f-41e2-f86e-8d1bdd9f6d2a/ANT-20221103v2.mp3"
545021419,"Behind the spread of false theories about the Pelosi attack","https://news-assets.apple.com/podcast/audio/de2e75e4-6483-4c64-beb7-6d34458d4fba/ANT-20221102v2.mp3"
544691839,"What the housing-market shift means for you","https://news-assets.apple.com/podcast/audio/4315e662-4c79-4afa-ce99-b561f689b3a2/ANT-20221101v1.mp3"
544712280,"Where voting rights stand going into the midterms","https://news-assets.apple.com/podcast/audio/a1336553-e0ca-4a09-c766-559860eaaf26/MID-20221101v3.mp3"
544327998,"Fears of political violence grow after attack on Paul Pelosi","https://news-assets.apple.com/podcast/audio/85d2a90d-5f99-43a7-b44f-15ce7dffd24a/ANT-20221031v2.mp3"
543604117,"How Elon Musk’s Twitter buy could affect elections","https://news-assets.apple.com/podcast/audio/f8a48adc-fc56-4929-9fc8-f7fc107f3c1a/ANT-20221028v2.mp3"
543368002,"Hear from swing-state voters on the midterms","https://news-assets.apple.com/podcast/audio/9db27acd-759a-47f2-e98d-3a2a8c2c85c8/ANT-20221027v2.mp3"
543134701,"Inside the post-Roe underground abortion-pill network","https://news-assets.apple.com/podcast/audio/f261a863-0256-49e7-a556-cbc55700490e/ANT-20221026v2.mp3"
543152938,"Inside the Democrats’ mad dash to Election Day","https://news-assets.apple.com/podcast/audio/71747bc1-d1c0-4ab2-916d-610102b32403/MID-20221026GDebenedetti_v4.mp3"
542892989,"Now we know how much the pandemic hurt kids’ learning","https://news-assets.apple.com/podcast/audio/5d76191f-4f23-4847-f3d5-55bc6a2a6ffa/ANT-20221025v2.mp3"
542668917,"New details from Ron DeSantis’s controversial voter arrests","https://news-assets.apple.com/podcast/audio/5ef68750-ca3d-4213-eecb-d5dd22af8d69/ANT-20221024v1.mp3"
542062539,"What you might not know about the Iran protests","https://news-assets.apple.com/podcast/audio/5e8db78b-6214-4bad-c2ce-46eb8a7c3139/ANT-20221021v3.mp3"
541819175,"Why midterms polling sites are boosting security","https://news-assets.apple.com/podcast/audio/feca20ec-6244-473b-e189-ada69919167b/ANT-20221020v3a.mp3"
541506739,"The big IRS changes that could reduce your tax bill","https://news-assets.apple.com/podcast/audio/94c6989b-36fd-49eb-c48b-18d5251b2b2c/ANT-20221019-v6.mp3"
541222722,"How to access federal student-loan forgiveness","https://news-assets.apple.com/podcast/audio/4cb505b5-8bee-41b2-bff2-28deea05d5f5/ANT-20221018-v2.mp3"
541226906,"How abortion could affect the election","https://news-assets.apple.com/podcast/audio/31feb9e0-c8fe-4fec-b6ad-ae042a543223/MID-20221018v9.mp3"
540950400,"What a third term for China’s Xi Jinping would mean","https://news-assets.apple.com/podcast/audio/e14c1711-3963-47d6-9524-0119673307cc/ANT-20221017-v2.mp3"
540364993,"What to know about big developments in Trump investigations","https://news-assets.apple.com/podcast/audio/6599fb0b-f390-448f-a5bc-a5a50aaf5f6b/ANT-20221014-v2.mp3"
540136497,"How a secret tape of racist remarks is rocking politics","https://news-assets.apple.com/podcast/audio/06e2c8d3-479a-44e2-9d0d-4b4b09321ee7/ANT-20221013-v4.mp3"
539845299,"Jake Tapper wants you to know C.J. Rice’s story","https://news-assets.apple.com/podcast/audio/6d9e11cb-7e71-4dc7-cb29-65685d9548d3/ANT-20221012-v2.mp3"
539555699,"Why protests in Iran are gaining new energy","https://news-assets.apple.com/podcast/audio/980669fc-a5c2-4772-ce96-93963221f6e5/ANT-20221011-v4.mp3"
539558855,"The “stunning and sobering” number of election deniers on the ballot this November","https://news-assets.apple.com/podcast/audio/9fffed92-70ba-4702-9a6a-09c2e959cf07/MID-20220920AGardner_v5.mp3"
539300179,"What to know about Russia’s latest attacks on Kyiv","https://news-assets.apple.com/podcast/audio/6e55fc31-4d14-4d26-88b4-d0cf7ae854a1/ANT-20221010-v3a.mp3"
538670129,"Biden warns of “Armageddon” amid Putin nuclear threats","https://news-assets.apple.com/podcast/audio/8ababbf4-126e-4889-cee1-8f7a53349f79/ANT-20221007v1.mp3"
538423757,"Understanding the controversy around Herschel Walker","https://news-assets.apple.com/podcast/audio/45e524a5-a95e-4288-9ff3-bedfdb7f6c91/ANT-20221006v1.mp3"
538098686,"How Iran is cracking down as protests intensify","https://news-assets.apple.com/podcast/audio/b7868b9f-c9d3-4779-e56a-c02afcafa5b0/ANT-20221005v2.mp3"
537830972,"Election 2022 Special: What’s at stake in the midterms?","https://news-assets.apple.com/podcast/audio/70799006-eaea-4da4-cdfd-a55fbbe97f42/MID-20221004-JZelizer_v4.mp3"
537827223,"How the 2022 midterms will test democracy","https://news-assets.apple.com/podcast/audio/1ef06608-8283-426c-c549-60e4b8b2bb4a/ANT-20221004v2.mp3"
537577058,"Why SCOTUS’s new term could be more impactful than its last","https://news-assets.apple.com/podcast/audio/66452eae-1925-4310-8fad-73cf4cab8354/ANT-20221003v3.mp3"
536879524,"Both Ukrainians and Russians are fleeing Putin’s war","https://news-assets.apple.com/podcast/audio/5983e0df-4b4e-4274-fcbd-4967d52ed493/ANT-20220930v2.mp3"
536081829,"Tracking Ian’s path of destruction across Florida","https://news-assets.apple.com/podcast/audio/f161f218-f96b-4aa3-fc6c-2ea6df99d4cb/ANT-20220929v3.mp3"
535130167,"Hurricane Ian tests Florida’s DeSantis","https://news-assets.apple.com/podcast/audio/1152b6b2-6d4c-4786-d363-b760ca20e260/ANT-20220928v1.mp3"
534365058,"Florida braces for Hurricane Ian after it hits Cuba","https://news-assets.apple.com/podcast/audio/3d0ffc6c-2b95-4383-8084-c6bad13f1ba4/ANT-20220927v1.mp3"
533740871,"Why protesters are taking to the streets in Iran and Russia","https://news-assets.apple.com/podcast/audio/1d1d259d-4f36-47ff-eb85-afb02a29aa29/ANT-20220926v1.mp3"
532455527,"At U.N. assembly, world condemns Putin’s war escalation","https://news-assets.apple.com/podcast/audio/ebe8082c-86d8-4860-963f-e6223febf40b/ANT-20220923v2.mp3"
532138940,"Why migrants flown to Martha’s Vineyard are suing DeSantis","https://news-assets.apple.com/podcast/audio/1a5f2c79-28d6-4013-e575-14fc2640c3a5/ANT-20220922v2.mp3"
531881402,"Why Putin is mobilizing 300,000 Russia reserve troops","https://news-assets.apple.com/podcast/audio/89f38e81-45a5-41d7-f915-9090a4786326/ANT-20220921v1.mp3"
531616285,"As Hurricane Fiona intensifies, Puerto Ricans remember Maria","https://news-assets.apple.com/podcast/audio/87dea4a1-7711-43c9-8822-26ca88fc0b6c/ANT-20220920v2.mp3"
531337141,"The extreme weather lashing Puerto Rico, Alaska, and Japan","https://news-assets.apple.com/podcast/audio/4d2cc049-49a6-44b1-9497-fcf2881b0921/ANT-20220919v2.mp3"
530567823,"Hear from families caught up in immigration politics","https://news-assets.apple.com/podcast/audio/d07c67fd-9df1-4bac-f0ed-4604db03a458/ANT-20220916v2.mp3"
530185162,"Why Democrats are helping the far right win GOP primaries","https://news-assets.apple.com/podcast/audio/f13849b4-d00b-42b3-a612-650d2589dbff/ANT-20220915v2.mp3"
529894414,"Rail workers are set to strike. How that could affect you.","https://news-assets.apple.com/podcast/audio/faa72508-9d9b-4789-e83f-7d27438dab08/ANT-20220914v1.mp3"
529637745,"Signs that the Trump investigations are intensifying","https://news-assets.apple.com/podcast/audio/b447930f-718c-4d5e-ba49-b5e4204dba51/ANT-20220913v1.mp3"
529386339,"One journalist’s mission to document Russian war crimes","https://news-assets.apple.com/podcast/audio/10891ce0-be0e-4f3f-e518-f480eddbaff0/ANT-20220912v1.mp3"
528840924,"How Queen Elizabeth II changed the monarchy","https://news-assets.apple.com/podcast/audio/a10b065d-b532-4bce-eed5-f7103d00942e/ANT-20220909v1.mp3"
528574427,"Understanding America’s big electricity problem","https://news-assets.apple.com/podcast/audio/fbb85b95-8b0b-45b6-8442-4abfda0a3039/ANT-20220908v1.mp3"
528313047,"Uvalde families speak out on return to school","https://news-assets.apple.com/podcast/audio/7786e248-3fef-4302-ecf3-71cef127ce0b/ANT-20220907v1.mp3"
