EID,Title,URL
466575320,"What to know about the DOJ’s massive bitcoin seizure","https://news-assets.apple.com/podcast/audio/5e2efc80-8536-436c-d278-cd951b4c0ab4/ANT-20220209v4.mp3"
466239536,"Go-bags and bunkers: Ukrainians brace for potential invasion","https://news-assets.apple.com/podcast/audio/5281629d-c31c-42be-e82f-2493ab22dfa0/ANT-20220208v3.mp3"
465902688,"Why rents are likely to keep rising this year","https://news-assets.apple.com/podcast/audio/b542953c-6700-4c9e-d436-f19889624030/ANT-20220207v2.mp3"
465343633,"In Conversation: They survived school shootings. How are they 20 years later?","https://news-assets.apple.com/podcast/audio/3707d7b7-8a01-46de-90ea-6cc263cf21e6/ANT-20220205v7.mp3"
465163646,"States crack down on shoddy COVID-testing practices","https://news-assets.apple.com/podcast/audio/a1f3f19c-b18c-40f5-89cb-b33dfbd63723/ANT-20220204v2.mp3"
464861279,"Yes, teachers are quitting. Here’s where they’re going.","https://news-assets.apple.com/podcast/audio/04929e3b-3220-494c-a857-a34a7c5ce838/ANT-20220203v3.mp3"
464494406,"A Black coach accuses NFL of racism in explosive lawsuit","https://news-assets.apple.com/podcast/audio/4f251320-909e-4ec6-c6c9-35c1aaf9a760/ANT-20220202v3.mp3"
464137946,"Families face tough choices as extra child tax credit ends","https://news-assets.apple.com/podcast/audio/e8a5b1ba-6aef-40a7-df1d-3867d8a8d509/ANT-20220201v2.mp3"
463793507,"Keeping score in the congressional-redistricting fight","https://news-assets.apple.com/podcast/audio/c1c24d8b-59c7-4cb9-ef0b-5f767020fa92/ANT-20220131v4.mp3"
463151279,"In Conversation: David Wallace-Wells makes the case for climate reparations","https://news-assets.apple.com/podcast/audio/5fb01f9f-7dc9-4788-8356-9c842931ec9e/ANT-20220129v9.mp3"
463015853,"How Russia’s military moves could raise your energy bill","https://news-assets.apple.com/podcast/audio/2a33529b-fd30-4ec5-e008-a183fafdf1a4/ANT-20220128v2.mp3"
462758615,"How Biden’s Supreme Court pick could make history","https://news-assets.apple.com/podcast/audio/546d2590-a112-49b8-cf1c-c49e7bc1791e/ANT-20220127v4.mp3"
462422981,"How inflation wipes out your pay raise","https://news-assets.apple.com/podcast/audio/d9bb9afc-9603-446c-cbe9-45b253b30e43/ANT-20210106v2.mp3"
462072849,"Why high meat prices might not just be a pandemic thing","https://news-assets.apple.com/podcast/audio/74e2c27e-315d-44be-f277-ab999b8159f9/ANT-20220125v2.mp3"
461757370,"Why federal funds for hungry kids aren’t reaching them","https://news-assets.apple.com/podcast/audio/42b89c49-71d5-43c9-9f43-731cd49fcf72/ANT-20220124v3.mp3"
461135179,"In Conversation: Nikole Hannah-Jones on the 1619 Project and reframing U.S. history","https://news-assets.apple.com/podcast/audio/890aacdf-1b02-41a6-98aa-97e6f1ff6faf/ANT-20220122v7.mp3"
460995734,"Why the “Havana syndrome” mystery still isn’t solved","https://news-assets.apple.com/podcast/audio/48debaaa-ab58-4ba4-c24c-62031d3b8817/ANT-20220121v5.mp3"
460719307,"How Biden could respond if Putin invades Ukraine","https://news-assets.apple.com/podcast/audio/9e13108a-44fa-4a75-88bf-af771e1da9c9/ANT-20220120v2.mp3"
460317472,"How well has Biden handled the pandemic? Experts weigh in.","https://news-assets.apple.com/podcast/audio/f70e0d22-b497-47e1-c366-ca005cd0c492/ANT-20220119v3.mp3"
459958764,"How cryptocurrency became a big political issue","https://news-assets.apple.com/podcast/audio/2d13b393-9bdc-46dc-c5b8-4e5764c62855/ANT-20220118v2.mp3"
459646038,"On MLK Day, new urgency over voting rights","https://news-assets.apple.com/podcast/audio/e2a513f0-8193-4855-fb13-9d87823ea81e/ANT-20220117v2.mp3"
459049212,"In Conversation: How one journalist helped her dad die","https://news-assets.apple.com/podcast/audio/069cc0e6-fbbb-4d83-e6d7-c928852d74d6/ANT-20220115v6.mp3"
458920521,"Inside Afghanistan’s hunger crisis","https://news-assets.apple.com/podcast/audio/7b3434b8-a312-4c5a-c901-3658a4a72887/ANT-20220114v2.mp3"
458686625,"Why so many U.S. grocery shelves are empty","https://news-assets.apple.com/podcast/audio/a22d9660-95bc-4d5a-e083-50c8a84d888c/ANT-20220113v2.mp3"
458510902,"“Wild Things" episode 1: What Went Wrong?","https://news-assets.apple.com/podcast/audio/c11d8c24-4d59-49a5-bd67-60c5f7ae950e/ANT-20220112WildThingsFullv1.mp3"
458297033,"The one change that could cut school shootings in half","https://news-assets.apple.com/podcast/audio/5bed0f81-054f-4d2a-e694-8e54448f9f64/ANT-20220112v2pod.mp3"
457970766,"What happens when everyone calls out sick at the same time","https://news-assets.apple.com/podcast/audio/0b7994fb-110a-4fe1-8615-10a83340fe49/ANT-20220111v3.mp3"
457659720,"The unexpected impact of banning Trump from social media","https://news-assets.apple.com/podcast/audio/d5535e37-6f58-400f-9244-c348ba89fd3e/ANT-20220110v2.mp3"
457061792,"In Conversation: Feeling burned out? Here’s how to rethink work.","https://news-assets.apple.com/podcast/audio/ab41c624-2a26-4431-81a4-cc4afd71b58f/ANT-20220108v5.mp3"
456951944,"We understand Omicron better now. Here’s what to know.","https://news-assets.apple.com/podcast/audio/96e1b61a-4689-47e2-f31b-4d95b42b599e/ANT-20220107v3.mp3"
456693427,"Hear why January 6 was just the beginning","https://news-assets.apple.com/podcast/audio/d96e303f-3465-41fd-e215-cf32f779f507/ANT-20220106v5.mp3"
456414606,"Why Chicago’s COVID school-safety fight matters nationwide","https://news-assets.apple.com/podcast/audio/ab37bc94-1e88-4874-8d0f-ce11001fcf91/ANT-20220105v3.mp3"
456067677,"Startup star to criminal: The downfall of Elizabeth Holmes","https://news-assets.apple.com/podcast/audio/5b737ad5-d25e-4fd2-fc9d-b9a572085fa8/ANT-20220104v3.mp3"
455791244,"Why 2022 might not be defined by the pandemic","https://news-assets.apple.com/podcast/audio/5a12ff4d-0f4f-4a08-91ef-a73cd95896ec/ANT-20220103v2.mp3"
453272131,"Good-news stories you may have missed in 2021","https://news-assets.apple.com/podcast/audio/bb81cf46-c780-407a-babe-35bb05331d1e/ANT-20211223v2.mp3"
452969006,"How the pandemic is killing non-COVID patients","https://news-assets.apple.com/podcast/audio/3dc458cf-f355-472a-efa1-e12bdfe0324c/ANT-20211222v2.mp3"
452618310,"What to know now that Omicron is dominant in the U.S.","https://news-assets.apple.com/podcast/audio/af6b0e2f-3d2b-41f6-f3ba-32b08519494e/ANT-20211221v2.mp3"
452334746,"What’s next for Biden’s agenda after Manchin’s “no”","https://news-assets.apple.com/podcast/audio/0d9419f2-9233-4e47-a3c9-9cc9504c1bfd/ANT-20211220v3.mp3"
451707677,"In Conversation: Did Marilyn Manson hide his abuse of women in plain sight?","https://news-assets.apple.com/podcast/audio/14acf494-7025-4af6-9161-62b336809a34/ANT-20211218v6.mp3"
451575809,"Biden’s big spending bill is still stuck. Here’s why.","https://news-assets.apple.com/podcast/audio/8b512b61-3768-4018-8c32-6ea882d4a790/ANT-20211217v3.mp3"
451453113,"Special Episode: Looking back on the making of 'Hooked'","https://news-assets.apple.com/podcast/audio/78528dd4-1466-4dda-92d9-a2b6e03e7901/ANT-20211215HookedICv4.mp3"
451324048,"Kamala Harris takes stock of a historic, turbulent year","https://news-assets.apple.com/podcast/audio/e37ceb8f-61dc-4074-b6e4-75e1de389f88/ANT-20211216v2.mp3"
450978748,"Stories of hope and resilience after the deadly tornadoes","https://news-assets.apple.com/podcast/audio/b1237208-4fee-4da6-f6a8-b8702da4553c/ANT-20211215v2.mp3"
450657426,"Why is the U.S. defense bill so large? No one seems to know.","https://news-assets.apple.com/podcast/audio/11ff9e66-2ec9-4efa-854e-d9b21872a860/ANT-20211214v3.mp3"
450336652,"What we know about climate change and deadly tornadoes","https://news-assets.apple.com/podcast/audio/8d3d2ebf-28ab-4864-8584-88d4b697b36b/ANT-20210106v4.mp3"
449702781,"In Conversation: Inside the secret prisons where migrants are tortured and beaten","https://news-assets.apple.com/podcast/audio/63beaa27-538d-4ca5-a59a-0faf8a3f88cc/ANT-20211211v7.mp3"
449599583,"Why the Starbucks union vote is such a big deal","https://news-assets.apple.com/podcast/audio/69bf1d28-c113-4d86-fcf0-7b5f884b1590/ANT-20211210v3.mp3"
449341089,"Why Biden’s spending plan may not solve the housing crisis","https://news-assets.apple.com/podcast/audio/b501f507-4955-47de-f743-0cb3e6f035e3/ANT-20211209v4.mp3"
449028071,"Was Elizabeth Holmes’s testimony enough to save her?","https://news-assets.apple.com/podcast/audio/0388f80b-cee0-4164-bafe-db536a87de57/ANT-20211208v2.mp3"
448656522,"Here’s what happens if Biden’s immigration overhaul passes","https://news-assets.apple.com/podcast/audio/d9ec16eb-cc35-4006-8872-36487936b8ea/ANT-20211207v2.mp3"
448325840,"How Biden’s spending plan could transform U.S. health care","https://news-assets.apple.com/podcast/audio/3a70daef-9149-4461-9af5-fe673b647967/ANT-20211206v2.mp3"
447581591,"In Conversation: America’s child-care system is broken. Can we fix it?","https://news-assets.apple.com/podcast/audio/556c91ee-81c2-42f9-ed96-52a7eb6d4f4c/ANT-20211204v6a.mp3"
447536611,"Why Delta is still dangerous as Omicron variant spreads","https://news-assets.apple.com/podcast/audio/b130d29b-8a6f-49da-858f-f80b80377055/ANT-20211203v2.mp3"
447266607,"The untold story of Mississippi’s sole abortion clinic","https://news-assets.apple.com/podcast/audio/b99cdff0-3928-472e-f686-9f461064f3d8/ANT-20211202v2.mp3"
446942044,"How activists are preparing for a post–Roe v. Wade America","https://news-assets.apple.com/podcast/audio/c3cf9ee1-829e-4536-f716-85db6ccf3b0d/ANT-20211201v2.mp3"
446547667,"The brutal shadow system keeping migrants out of Europe","https://news-assets.apple.com/podcast/audio/82f8e77a-7403-4986-e4a1-a4db4ed71595/ANT-20211130v2.mp3"
446224948,"What we know — and don’t — about the Omicron variant","https://news-assets.apple.com/podcast/audio/9296720f-8e18-493a-ec4f-33de74eb40cb/ANT-20211129v2.mp3"
444610437,"Who gets to claim self-defense in fatal shootings?","https://news-assets.apple.com/podcast/audio/f7467b58-a344-4b8b-c3ad-498da4984386/ANT-20211123-v3.mp3"
444265260,"How a $2 trillion plan could transform the social safety net","https://news-assets.apple.com/podcast/audio/f47c6f3d-1468-427d-bc99-cdfa58b92542/ANT-20211122-v2.mp3"
443651087,"In Conversation: Jelani Cobb on the backlash to critical race theory","https://news-assets.apple.com/podcast/audio/05b44047-e293-4545-ea1c-a83ba22b6389/ANT-20211120v7.mp3"
443515354,"Why it’s time to check in on Europe’s unusual border crisis","https://news-assets.apple.com/podcast/audio/9bde305f-c347-4f5c-b70d-bd31175c5311/XXANT-20211119-v3-altXX.mp3"
443237931,"House votes largely on party lines to censure Paul Gosar","https://news-assets.apple.com/podcast/audio/bdac5936-7f25-4f87-d76d-7eebedce5889/ANT-20211118-v2.mp3"
442831525,"Fears for U.S. medical system as health-care workers quit","https://news-assets.apple.com/podcast/audio/fa73f55b-5354-4333-bfe2-3629613710ea/ANT-20211117-v3.mp3"
442372728,"What the jury must decide in the Rittenhouse trial","https://news-assets.apple.com/podcast/audio/1e332c78-e286-4d77-a6a0-ac479c55b41b/ANT-20211116-v2.mp3"
442031026,"People with disabilities say flying is routinely dehumanizing","https://news-assets.apple.com/podcast/audio/3dba2c18-4633-4e87-a8cd-15d1b741e081/ANT-20211115-v2.mp3"
441316905,"In Conversation: Does blood hold the key to the fountain of youth?","https://news-assets.apple.com/podcast/audio/3345cf18-ffa2-4e50-bc1c-e698f1c14c54/ANT-20211113v7.mp3"
441204872,"Election workers feel threatened, scared, and ignored","https://news-assets.apple.com/podcast/audio/01ecdba4-8738-45fe-ba9c-f2b5fe9d297e/ANT-20211112-v2.mp3"
440957421,"How police officers punish their own","https://news-assets.apple.com/podcast/audio/76556afb-eb15-434d-c615-b00307367c98/ANT-20211111-v3.mp3"
440682069,"Starbucks pushes back against efforts to unionize","https://news-assets.apple.com/podcast/audio/97db53e7-0cfc-451c-ae7b-5fe57448447b/ANT-20211110-v3.mp3"
440420717,"The clean-water crisis that huge new spending may not fix","https://news-assets.apple.com/podcast/audio/c6d51959-cd7b-4dfe-c3db-d2041b556207/ANT-20211109-v2.mp3"
440138660,"Experts fear Astroworld won’t be the last deadly concert","https://news-assets.apple.com/podcast/audio/22660faf-2c54-43ee-c33a-85d5acef805b/ANT-20211108-v3.mp3"
439575833,"In Conversation: How an opioid addiction drove one engineer to rob banks","https://news-assets.apple.com/podcast/audio/0d6f912f-f46a-472e-95b2-a564e4c8e5c0/ANT-20211106v7podIC.mp3"
439575832,""Hooked" episode 1: The Fatal Funnel","https://news-assets.apple.com/podcast/audio/bffd3408-b552-4040-c5e0-0548c1ab9cf6/ANT-20211106v7podHooked.mp3"
439492712,"Could your neighborhood be a cancer hot spot?","https://news-assets.apple.com/podcast/audio/9df83584-aee1-4ce3-afb9-81e934d738f3/ANT-20211105v2.mp3"
439200858,"Island nations, at risk of disappearing, urge climate action","https://news-assets.apple.com/podcast/audio/ffe16ab7-3527-4d8a-99bd-013582fa4cca/ANT-20210106v3.mp3"
438773423,"Here’s what the GOP’s Virginia win could mean nationally","https://news-assets.apple.com/podcast/audio/7b256baf-021c-4f8b-9af4-b09b57c613a0/ANT-20211103v2.mp3"
438298917,"The people who clean up after climate disasters","https://news-assets.apple.com/podcast/audio/6b6da824-bf34-47c4-f396-ddc513cbc237/ANT-20211102v3.mp3"
437841214,"What to know as Supreme Court considers Texas abortion ban","https://news-assets.apple.com/podcast/audio/2c46bad4-9baf-41df-e564-1f2b9c0f2b07/ANT-20211101v2.mp3"
437140961,"In Conversation: Kids were jailed for a crime that doesn’t exist. How could that happen?","https://news-assets.apple.com/podcast/audio/8ebb4d4c-26df-402e-f2d6-4ae99ad848c0/ANT-20211030v5.mp3"
437014978,"How China and the U.S. are falling short on climate action","https://news-assets.apple.com/podcast/audio/7ea31916-82be-4c12-95c5-449940b40e93/ANT-2021029v2.mp3"
436707464,"Paid leave appears dead in Congress. Here’s what that means.","https://news-assets.apple.com/podcast/audio/729c8f08-b2f6-47a7-8557-fe3882c2be64/ANT-20211028v3.mp3"
436405772,"Democrats want billionaires to pay up in new tax plan","https://news-assets.apple.com/podcast/audio/c322533d-8442-41bc-fb2f-2848265dadcd/ANT-20210927-v2.mp3"
436023673,"Here’s what to watch in next week’s governor’s races","https://news-assets.apple.com/podcast/audio/4032ddf6-3b8f-48d4-87b8-622f392b4efc/ANT-20211026-v2.mp3"
435712451,"What’s driving the extreme weather on the West Coast","https://news-assets.apple.com/podcast/audio/f8e03640-d88c-4ac7-ba1e-f593d5eb0b49/ANT-20211025v3.mp3"
435123910,"In Conversation: Think the stock market is rigged? You may be right.","https://news-assets.apple.com/podcast/audio/b334e767-6d14-4931-b1aa-e48717dd0bc0/ANT-20211023v6.mp3"
435039535,"Why the world is watching Congress’s climate-change moves","https://news-assets.apple.com/podcast/audio/3dde45f6-963a-4731-9365-1955b520252d/ANT-20211022v3.mp3"
434764357,"Democrats ramp up unusual legal fight with Steve Bannon","https://news-assets.apple.com/podcast/audio/c34b08f7-51de-44ee-b885-72f0fb6db52c/ANT-20211021v2.mp3"
434383364,"The problem of cops who won’t get vaccinated","https://news-assets.apple.com/podcast/audio/6fc1a997-b06b-4a9d-f206-09ac959707d3/ANT-20211020v3.mp3"
433956671,"Why time may be running out for Biden’s climate plan","https://news-assets.apple.com/podcast/audio/2bf1bf93-125b-4317-bef0-39aa5321f3ca/ANT-20211019v2.mp3"
433628747,"Murder trial begins in the killing of jogger Ahmaud Arbery","https://news-assets.apple.com/podcast/audio/8109c9c7-6bdf-4655-b560-3d9b377f6fba/ANT-20211018v5.mp3"
432977967,"In Conversation: Delivery workers feel exploited. They’re fighting back.","https://news-assets.apple.com/podcast/audio/27861bc9-adf1-43b6-edb4-379918019124/ANT-20211016v4.mp3"
432847344,"What’s holding up federal aid to renters?","https://news-assets.apple.com/podcast/audio/98306353-f6b8-477d-e6e8-f9c011f76add/ANT-20211015v2.mp3"
432543286,"The latest moves in the Capitol-attack investigation","https://news-assets.apple.com/podcast/audio/ac2cd57c-c226-43f8-c9be-af5d630c3a6f/ANT-20211014v2.mp3"
432234088,"Why so many American workers are on strike right now","https://news-assets.apple.com/podcast/audio/def35f9a-8118-4f4d-e85c-04b269e191f4/ANT-20211013v2.mp3"
431899216,"NFL coach out after revelations of offensive emails","https://news-assets.apple.com/podcast/audio/ba57c032-ce09-4224-fb0a-f15389a3cade/ANT-20211012v2.mp3"
431550823,"Why U.S. child care is in crisis and what to do about it","https://news-assets.apple.com/podcast/audio/81d02f9e-ce77-4d23-b9a8-2c53d2c384fd/ANT-20211011v2.mp3"
430886726,"In Conversation: Is bipartisanship dead?","https://news-assets.apple.com/podcast/audio/8d7f70fd-e925-45c9-e363-c7b3a9052371/20211009-ANT-InConversation-v3.mp3"
430761868,"Journalists share Nobel Peace Prize for press-freedom fight","https://news-assets.apple.com/podcast/audio/e68d8e01-93ae-41e4-b791-dfbac085cff5/ANT-20211008-v4.mp3"
430474612,"A new twist in the fight over the debt ceiling","https://news-assets.apple.com/podcast/audio/fd1fc72c-f1d6-48bf-fdf6-7cc55b96f4bb/ANT-20211007v3.mp3"
430117321,"What role did pharmacies play in the opioid crisis?","https://news-assets.apple.com/podcast/audio/95b1f7b3-7ef2-4867-cd98-301a0fa1cb1e/ANT-20211006v2.mp3"
429740577,"Understanding the global impact of the Facebook outage","https://news-assets.apple.com/podcast/audio/447874cc-1394-44b4-fac7-77f21e7a4f48/ANT-20211005v4.mp3"
429381901,"Pandora Papers reveal how elites hide vast fortunes","https://news-assets.apple.com/podcast/audio/c6918b25-5e2b-4261-a3af-19bccb6d3e30/ANT-20211004-v3.mp3"
428709179,"In Conversation: Bob Woodward and Robert Costa on the final months of Trump’s presidency","https://news-assets.apple.com/podcast/audio/d2f76e8e-7ded-4e50-e59f-c17636235a09/20211002-ANT-InConversation-v4.mp3"
428542675,"The government didn’t shut down, but Dems are divided","https://news-assets.apple.com/podcast/audio/013e4580-86cd-4e61-efa7-df8d8cfbb490/ANT-20211001-v3.mp3"
428263806,"Lawmakers go to bat over looming shutdown deadline","https://news-assets.apple.com/podcast/audio/6272efe3-1b9f-4f1f-89be-70f3eee860b4/ANT-20210930-v3.mp3"
427869410,"Biden’s agenda is on the line. Here’s who may hold the key.","https://news-assets.apple.com/podcast/audio/6c270d14-b435-49ff-d439-a115bc499542/ANT-2020929-v4.mp3"
427435080,"A trillion-dollar coin? How to end the debt-ceiling debate.","https://news-assets.apple.com/podcast/audio/cfac4488-7449-4251-cfb5-863b2c3a4dce/ANT-20210928v4.mp3"
427051606,"Here’s what you need to know about booster shots","https://news-assets.apple.com/podcast/audio/10544d05-6f1a-4705-a5b0-2fc2de9f02bc/ANT-20210927-v3.mp3"
426435238,"In Conversation: Investigation reveals what Facebook hides about its platforms","https://news-assets.apple.com/podcast/audio/d49796f8-340e-476c-b0f3-e497e1884584/ANT-InConversation-20210925-v4.mp3"
426269359,"Biden border policy criticized as Haitians are deported","https://news-assets.apple.com/podcast/audio/9ce21e9d-30c1-408d-b02e-f0fae029ab26/ANT-20210924-v4.mp3"
426011130,"Federal police reform is dead, but states have solutions","https://news-assets.apple.com/podcast/audio/c9a3f0be-201b-400f-c858-62b0a97e19d5/ANT-20210923-v2.mp3"
425707905,"How the child-care shortage could damage the whole economy","https://news-assets.apple.com/podcast/audio/12999a90-6d38-47fe-e994-0a26a1c0b979/ANT-20210922v3.mp3"
425399377,"Lawsuit against doctor tests new Texas abortion ban","https://news-assets.apple.com/podcast/audio/39fc3f00-e338-4be5-9f5c-a2c44a47f9e6/ANT-20210921v2.mp3"
425191828,"Why the U.S. is deporting Haitians from the Mexico border","https://news-assets.apple.com/podcast/audio/e2fa6bbe-dbb2-4444-bc25-6af324dd1eae/ANT-20210920v2.mp3"
424488888,"In Conversation: The story of Jane Roe, her baby, and abortion in America","https://news-assets.apple.com/podcast/audio/a0af44f3-3e44-4911-b6dc-d990a29bc706/ANT-20210918v3pod.mp3"
424360988,"Hospitals at capacity struggle to treat non-COVID patients","https://news-assets.apple.com/podcast/audio/c712394b-27a1-4c10-c169-39e7febc42e2/ANT-20210917v2.mp3"
424029024,""We have been failed.” Gymnasts say FBI ignored sex abuse.","https://news-assets.apple.com/podcast/audio/e5cebdbb-f168-487e-924d-3bd7843d5614/ANT-20210916v4.mp3"
423651905,"Why at-home COVID tests are so expensive in the U.S.","https://news-assets.apple.com/podcast/audio/00af6d04-202c-4012-80e4-a1c8062be0d9/ANT-20210915v3.mp3"
423254959,"Republicans push false election-fraud claim in Newsom recall","https://news-assets.apple.com/podcast/audio/8a484b30-41dc-488e-ae94-c343b0fd55e1/ANT-20210814v2.mp3"
422910102,"What counts as a religious exemption to a vaccine mandate?","https://news-assets.apple.com/podcast/audio/ce9283c0-f500-4331-f76a-2b6ee4569e9e/ANT-20210913-v3.mp3"
422259950,"In Conversation: How America’s 9/11 response led to the Capitol insurrection","https://news-assets.apple.com/podcast/audio/1eca9216-0eaa-4ed5-cefc-ced0b9c108a8/ANT-20210911v7pod.mp3"
422140487,"Victims’ families fight to see secret 9/11 files","https://news-assets.apple.com/podcast/audio/ab4b886b-029f-401b-ea85-982fe2982e74/ANT-20210910v2.mp3"
421854304,"How 9/11 launched a new era of security spending","https://news-assets.apple.com/podcast/audio/5be3055e-e8d4-420b-ae01-a11525c6412b/ANT-20210909v2.mp3"
421514866,"Here’s why the accused 9/11 planner is still awaiting trial","https://news-assets.apple.com/podcast/audio/6aa4029c-7202-4085-9e98-52339f2b9b86/ANT-20210908v3.mp3"
421115495,"Here’s how expiring jobless benefits can affect everyone","https://news-assets.apple.com/podcast/audio/fd62569c-9cfc-4bf8-fa6c-6e9e48aa907e/ANT-20210907v2.mp3"
420165495,"In Conversation: What happened when a man made a chatbot of his dead fiancée","https://news-assets.apple.com/podcast/audio/6c40a7e9-69a2-46b8-fb7f-763f4b65b062/ANT-20210904v2pod.mp3"
420035179,"Expert answers to your questions about COVID safety for kids","https://news-assets.apple.com/podcast/audio/8b0ca8a1-135b-4da2-c097-d9dabccfac12/ANT-20210903v3.mp3"
419754301,"End of eviction ban threatens 750,000 households","https://news-assets.apple.com/podcast/audio/ebe56b62-eda7-4916-8caf-48d4c27c9165/ANT-20210902v3.mp3"
419418005,"Controversial Texas abortion ban comes at pivotal moment","https://news-assets.apple.com/podcast/audio/0167da1c-f43b-4931-8716-e3b1f1c9660a/ANT-20210901v2.mp3"
419028813,"Ida’s warning: Cities aren’t ready for fast-growing storms","https://news-assets.apple.com/podcast/audio/42adb90a-9b92-4e7f-9364-436143119773/ANT-20210831v2.mp3"
418704841,"Danger and darkness: Louisiana reels from Hurricane Ida","https://news-assets.apple.com/podcast/audio/b7ac5ba7-44c7-4952-cf20-24df74e74a4e/ANT-20210830v2.mp3"
418061862,"In Conversation: Jason Parham on how Black Twitter became a cultural force","https://news-assets.apple.com/podcast/audio/881ac66f-36a3-4eb9-a820-babbff220c44/ANT-InConversation-20210828-pod-v5.mp3"
417954312,"U.S. braces for more attacks as Afghan evacuations continue","https://news-assets.apple.com/podcast/audio/42fd427f-ea50-4c39-a1c8-53517bbfa401/ANT-20210827-v2.mp3"
417702081,"The national implications of California’s recall election","https://news-assets.apple.com/podcast/audio/4d15dea3-7de7-42a5-e51b-1dda62dea573/ANT-20210826-AP_v3.mp3"
417360866,"Democrats approve a budget plan. Now comes the hard part.","https://news-assets.apple.com/podcast/audio/11e4130f-292f-43e5-edf8-1798381c3d52/ANT-20210825v2.mp3"
416978520,"Taliban takeover creates a money problem for Afghans","https://news-assets.apple.com/podcast/audio/383712fb-4b67-4e34-b780-1d342c3b2a41/ANT-20210824v2pod.mp3"
416653911,"What it’s like on the ground after Haiti’s earthquake","https://news-assets.apple.com/podcast/audio/4230274b-d32f-4578-ba29-fc941eb6bede/ANT-20210823-FN.mp3"
416001008,"In Conversation: Craig Whitlock on 20 years of U.S. lies about Afghanistan","https://news-assets.apple.com/podcast/audio/04a69d32-d479-43e9-c3a7-77106417bffd/ANT-InConversation-20210822-podcast_v2.mp3"
415893840,"Dispatch from Kabul: Life after the Taliban takeover","https://news-assets.apple.com/podcast/audio/5223a8d6-c7b4-4014-e116-30c793215d00/ANT-20210820-v2-pod.mp3"
415620193,"Images tell the story of what's at stake for Afghan women","https://news-assets.apple.com/podcast/audio/0d4e22ea-3907-4128-d399-846dd4a99436/ANT-20210819v2.mp3"
415295034,"Global powers hedge bets as Taliban takes Afghanistan","https://news-assets.apple.com/podcast/audio/0b8a7484-83f5-4850-e15b-b24dc7d5d115/ANT-20210818v2.mp3"
414934019,"What happens to Afghans who helped U.S. troops?","https://news-assets.apple.com/podcast/audio/c1249eec-3b49-4876-d1b7-628fe89a81a8/ANT-20210817v2.mp3"
414577373,"How America’s Afghanistan exit will affect the world","https://news-assets.apple.com/podcast/audio/edc43e91-66dc-4ed8-f5ff-6801b3dbcfd2/ANT-20210816v2.mp3"
413912945,"In Conversation: E. Alex Jung on who writer Anthony Veasna So might’ve been","https://news-assets.apple.com/podcast/audio/a0ce6f74-27ca-4a4a-959e-82414aac14e5/ANT-20210812v2pod.mp3"
413816600,"Former Army officer reflects on U.S. mistakes in Afghanistan","https://news-assets.apple.com/podcast/audio/a1a7c0ba-0de5-424f-cb4a-715a2eca7a73/ANT-20210813v2.mp3"
413548429,"U.S. tosses expiring vaccines as the world waits for doses","https://news-assets.apple.com/podcast/audio/54639a52-eb59-4d06-c2a4-336caf316156/ANT-20210812v2.mp3"
413180505,"Cuomo is out. Meet the woman who will replace him.","https://news-assets.apple.com/podcast/audio/8df54a4b-e15e-4848-ea8b-cd707c71696a/ANT-20210811v3.mp3"
412803842,"Back-to-school is looming. Why aren’t more kids vaccinated?","https://news-assets.apple.com/podcast/audio/93bd2de5-ff08-49f8-ddf0-31994d137052/ANT-20210810v2.mp3"
412447910,"Afghan troops losing to Taliban following U.S. withdrawal","https://news-assets.apple.com/podcast/audio/574be4b1-daa0-4772-fd87-b4e08d494202/ANT-20210809v2.mp3"
