EID,Title,URL
327709247,"The police response to right-wing protesters","https://news-assets.apple.com/podcast/audio/70c47335-6907-442e-d68e-85c221fc5832/ANT-20200901v6pod.mp3"
327709246,"Political pressure casts doubt on FDA’s independence","https://news-assets.apple.com/podcast/audio/c767a543-26b9-46d7-eae1-8a59d31cfafc/ANT-20200831v3pod.mp3"
327709245,"What would a second Trump term mean for America?","https://news-assets.apple.com/podcast/audio/0a40ce59-1440-4a93-c188-12824f566141/ANT-20200828v5.mp3"
327709244,"Pence addresses voters amid a trifecta of crises","https://news-assets.apple.com/podcast/audio/2b1df82b-2427-4a79-93d8-f7affd9e5ee1/ANT-20200827v3.mp3"
327709243,"The sibling rivalry inside the Trump family","https://news-assets.apple.com/podcast/audio/977bcd78-ef8b-452f-e063-a4ac1be6943d/ANT-20200826v3.mp3"
327709242,"RNC speakers say suburbs are under threat. Is it true?","https://news-assets.apple.com/podcast/audio/0ca271a6-5538-4982-f93f-8bbd2fdbe805/ANT-20200825v4.mp3"
327709241,"How Trump has forever changed the Republican Party","https://news-assets.apple.com/podcast/audio/cb521b61-6630-4d1c-bb0d-7dff029b89c3/ANT-20200824v3.mp3"
327709240,"Joe Biden closes out the DNC, while Republicans look ahead","https://news-assets.apple.com/podcast/audio/de0bb4ad-2694-4ad3-b80c-8429eb656736/ANT-20200821v3pod.mp3"
327709239,"After Kamala Harris wins VP nomination, a look at her record","https://news-assets.apple.com/podcast/audio/57979b8f-04f8-4e39-88b3-b5f5f0081fbb/ANT-20200820v3pod.mp3"
327709238,"A week after severe weather, Iowans feel abandoned","https://news-assets.apple.com/podcast/audio/aa6fad4f-0bfd-4692-8673-33e2627db273/ANT-20200819v3pod.mp3"
327709237,"Highlights from the first night of a virtual DNC","https://news-assets.apple.com/assets/podcast/audio/90716319-4989-49af-d394-c55ab2895625/ANT-20200818podV3.mp3"
327709236,"Crisis at the Postal Service ahead of the 2020 election","https://news-assets.apple.com/assets/podcast/audio/779123d7-013e-45a7-942b-a6282bb59a85/ANT-20200817podV2.mp3"
327709235,"As Congress leaves town without a deal, economists worry","https://news-assets.apple.com/assets/podcast/audio/fa023d03-d39b-45b3-90f9-67f0519e7630/ANT-20200814podV3.mp3"
327709234,"This doctor could decide the fate of a coronavirus vaccine","https://news-assets.apple.com/assets/podcast/audio/f84b0041-8515-4e49-cd5d-db23e4c32113/ANT-20200813podV4.mp3"
327709233,"Everything you need to know about Kamala Harris","https://news-assets.apple.com/assets/podcast/audio/74d3fbca-e236-4b7c-f7d1-dfda053575e2/ANT-20200812podV5.mp3"
327709232,"How teachers are protecting themselves from COVID-19","https://news-assets.apple.com/assets/podcast/audio/a39f32e3-44ac-4a1e-fac7-3fd0acd7e5e0/ANT-20200811v2.mp3"
327709231,"How will the media treat the next female VP candidate?","https://news-assets.apple.com/assets/podcast/audio/5aa83f27-8110-4f2f-83b1-2b604995a041/ANT-20200810v3.mp3"
327709230,"Why 1 in 13 Black adults can’t vote","https://news-assets.apple.com/assets/podcast/audio/9d65ddd1-6c5c-4db2-8b53-54cb2c169823/ANT-20200807v6.mp3"
327709229,"Lebanon faces a crisis within a crisis","https://news-assets.apple.com/assets/podcast/audio/469989e1-8613-4f77-fff5-3deedbc0a1e7/ANT-20200806v2.mp3"
327709228,"Lessons from the 2020 primaries","https://news-assets.apple.com/assets/podcast/audio/f927e767-f968-44c6-ca4f-ccae0a655c97/ANT-20200805v3.mp3"
327709227,"The failed American COVID-19 response, ballot delays, life on a private jet","https://news-assets.apple.com/assets/podcast/audio/4ebd00c3-b5d2-4e5a-e4e0-ae9a018912c9/ANT-20200804v2.mp3"
327709226,"Coronavirus lawsuits, the declining birth rate, teenagers work the polls","https://news-assets.apple.com/assets/podcast/audio/9e75721a-c168-4926-a12e-4319c99fef63/ANT-20200803v2.mp3"
327709225,"$600 on the line, Supreme Court secrets, Van Gogh’s final days","https://news-assets.apple.com/assets/podcast/audio/56f1cbe8-d025-4979-aeb7-62f1a7ba6f71/ANT-20200731v2.mp3"
327709224,"Have we grown numb to the soaring U.S. death toll?","https://news-assets.apple.com/assets/podcast/audio/39020237-9ada-4c9a-965e-56dad9025b36/ANT-20200730v8.mp3"
327709223,"The U.S. has a child care crisis","https://news-assets.apple.com/assets/podcast/audio/817b5814-d5a5-4da6-aa1f-a8778c0c6ffc/ANT-20200729v3.mp3"
327709222,"Biden's choice","https://news-assets.apple.com/assets/podcast/audio/c29b1003-e35e-4a65-8f66-8230e15ca5eb/ANT-20200728v3.mp3"
327709221,"The federal response to protests","https://news-assets.apple.com/assets/podcast/audio/de1942de-6f1d-4db3-d742-f1281d9cc3cd/ANT-20200727v4.mp3"
327709220,"Climate change and the looming migration crisis","https://news-assets.apple.com/assets/podcast/audio/09126fcf-ed28-40fb-fe97-b3f5013ed1c9/ANT-20200724v3.mp3"
327709219,"Portland's “Wall of Moms”","https://news-assets.apple.com/assets/podcast/audio/a7734f1e-96c9-421d-f134-202145ee1c87/ANT-20200723v7.mp3"
327709218,"Hackers target vaccine research","https://news-assets.apple.com/assets/podcast/audio/8fce0e89-7ea9-4040-9910-782e15c57170/ANT-20200722v3.mp3"
327709217,"Coronavirus vaccine trials show encouraging results","https://news-assets.apple.com/assets/podcast/audio/71116052-0605-420e-cdc0-348a4166faa0/ANT-20200721v3.mp3"
327709216,"America honors John Lewis","https://news-assets.apple.com/assets/podcast/audio/c64251d8-172d-4ea4-8202-157e3aa0d210/ANT-20200720v3.mp3"
327709214,"Two very different environmental plans","https://news-assets.apple.com/assets/podcast/audio/7058281a-1df2-4512-eea5-641997cd3ea0/ANT-20200717v3.mp3"
327709213,"The cost of voting in a pandemic","https://news-assets.apple.com/assets/podcast/audio/58d6a217-c3a4-4e8a-806f-604a6190c386/ANT-20200708v3.mp3"
633888502,"Apple News Today","https://news-assets.apple.com/podcast/audio/dfa9eb17-0c0f-4256-e4f0-02ae5698fe56/ANT-20230913-Trailer-v4.mp3"
327709212,"Introducing Apple News Today","https://news-assets.apple.com/assets/podcast/audio/67e7a910-48b8-4a87-be79-e042ad15effc/ANT-20200715v5.mp3"
706023486,"Comparing Biden and Trump on Netanyahu and Gaza","https://news-assets.apple.com/podcast/audio/4d6b8048-26e3-45a3-b3c8-c87568fc391d/ANT-20240530v3.mp3"
705733799,"What to watch as jurors consider Trump’s fate","https://news-assets.apple.com/podcast/audio/c871343f-391d-4d92-8642-93b0c7a4c408/ANT-20240529v2.mp3"
705453946,"Why voters have become so partisan about the economy","https://news-assets.apple.com/podcast/audio/170f3919-039a-4c8f-a8db-78b4d96b55f5/ANT-20240528v3.mp3"
704376066,"U.S. sunscreen is years behind the world. Here’s why.","https://news-assets.apple.com/podcast/audio/10a1a2f5-a351-40d9-9458-c4f010ff66b4/ANT-20240524v2.mp3"
703997042,"Unpacking the controversies around Justice Alito","https://news-assets.apple.com/podcast/audio/1ee6e35e-a2ee-4884-c954-b2daf2ec5e1b/ANT-20240523v7.mp3"
703668055,"Scarlett Johansson, others say their voices are being copied","https://news-assets.apple.com/podcast/audio/357006e5-5241-47df-87d7-5a2aa934bab3/ANT-20240522v2.mp3"
703310845,"What to know as Trump’s hush-money trial nears its end","https://news-assets.apple.com/podcast/audio/12f8fc0b-bebd-4d9f-8ec7-2a85000ddbf0/ANT-20240521v3.mp3"
702959638,"What’s next after the death of Iran’s president","https://news-assets.apple.com/podcast/audio/8ce796b4-ad83-4e16-ef60-926bbebc8e34/ANT-20240520v3.mp3"
702330417,"How two decades of same-sex marriages changed the U.S.","https://news-assets.apple.com/podcast/audio/ce3ecf27-6e3f-4f46-cea4-10842ae0a421/ANT-20240523v6.mp3"
702052735,"How Trump’s criticism of judges triggers violent threats","https://news-assets.apple.com/podcast/audio/f74a2c96-ec0f-4c53-fb59-ed3d4eeec154/ANT-20240516v2.mp3"
701714510,"Israeli whistleblowers allege abuse of detained Palestinians","https://news-assets.apple.com/podcast/audio/10a9bda1-026c-40dc-f2f3-33bc02b3c5d1/ANT-20240515v6.mp3"
701422327,"Inside Rafah’s “horrifying” health crisis","https://news-assets.apple.com/podcast/audio/2989df9f-adb0-4894-d0c2-3552b30e123d/ANT-20240514v2.mp3"
701179418,"Don’t expect Trump’s political fate to be decided by courts","https://news-assets.apple.com/podcast/audio/c8eff45e-0051-47d5-9818-f1910da8369c/ANT-20240513v3.mp3"
700471486,"What Biden’s Rafah “red line” could mean for the war in Gaza","https://news-assets.apple.com/podcast/audio/5e9f7dc7-fd7e-4152-f8d2-24033ac7ce92/ANT-20240510v2.mp3"
700100771,"The increasingly common 911 call frustrating first responders","https://news-assets.apple.com/podcast/audio/ee7762dd-2b4c-4ca3-8b20-17af4dd917c2/ANT-20240509v2.mp3"
699792844,"Why disrupted graduations feel familiar for class of 2024","https://news-assets.apple.com/podcast/audio/42473b84-07db-4af7-d329-7a62bf4bd17f/ANT-20240508v2.mp3"
699469711,"Essential reporting on campus protests, by student journalists","https://news-assets.apple.com/podcast/audio/bef65603-e198-42ab-ab77-650c0a360a8d/ANT-20240507v2.mp3"
699164567,"What to know about Gaza ceasefire talks","https://news-assets.apple.com/podcast/audio/7272fe9e-1ec6-4a86-e539-aca843bddd86/ANT-20240506v5.mp3"
698400194,"Inside an assassination plot on American soil","https://news-assets.apple.com/podcast/audio/098f0163-11b4-4966-9bb2-359f514acbc6/ANT-20240503v1.mp3"
698033018,"What students protesting over Gaza want colleges to do","https://news-assets.apple.com/podcast/audio/ce27035f-2668-42a4-c546-4963a360eec1/ANT-20240502v3.mp3"
697580158,"How Trump wants to reshape America in a second term","https://news-assets.apple.com/podcast/audio/5f5e93e6-fcea-45e3-b9b3-556752046219/ANT-20240501v3.mp3"
697233880,"Trump goes back to court as hush-money trial resumes","https://news-assets.apple.com/podcast/audio/e8f2cfbc-a4b4-4e86-b833-78ecf9b8c0bf/ANT-20240430v3.mp3"
696915000,"How the U.S. used troops on student protesters in the past","https://news-assets.apple.com/podcast/audio/d6011dba-1116-450a-ad16-42565ad2a344/ANT-20240429v1.mp3"
696050494,"Why Harvey Weinstein’s N.Y. rape conviction was overturned","https://news-assets.apple.com/podcast/audio/2d8af29b-6a38-4711-aa2e-52f858785281/ANT-20240426v2.mp3"
695650852,"The Supreme Court hears Trump’s unprecedented immunity claim","https://news-assets.apple.com/podcast/audio/59deeeab-32e1-45c0-cb37-8570feb81889/ANT-20240425v5.mp3"
695251042,"The move that could change 30 million Americans’ jobs","https://news-assets.apple.com/podcast/audio/3466ed75-90e4-4ec6-ae84-9553355ec9ad/ANT-20240424-v1.mp3"
694817368,"More arrests of college students protesting the war in Gaza","https://news-assets.apple.com/podcast/audio/8c256e9d-c89e-447a-d85f-7fab6f009a1b/ANT-20240423-v2.mp3"
694459155,"Who is Juan Merchan, the judge in Trump’s hush-money trial?","https://news-assets.apple.com/podcast/audio/fe728720-8576-4865-d373-0839c05b7636/ANT-20240422-v2.mp3"
693793085,"How guns became ubiquitous in the U.S. after Columbine","https://news-assets.apple.com/podcast/audio/677406c7-e106-4b52-e411-117846b66e02/ANT-20240419v5.mp3"
693440690,"Understanding the blame game over Gaza aid delays","https://news-assets.apple.com/podcast/audio/f465f2f2-8e43-41d5-a011-959a9d944546/ANT-20240418v1.mp3"
693168283,"Their ship hit the Key Bridge. Why are they stuck aboard?","https://news-assets.apple.com/podcast/audio/e235cf68-4c06-47b1-92d0-0165cb4e0208/ANT-20240417v4.mp3"
692919973,"Supreme Court hears Jan. 6 case with implications for Trump","https://news-assets.apple.com/podcast/audio/6e4fcf53-833f-44c2-973b-d8c6bd1af5f2/ANT-20240416v4.mp3"
692649760,"Understanding the charges in Trump’s historic criminal trial","https://news-assets.apple.com/podcast/audio/134f15ea-2562-408c-edcd-6598eefb606e/ANT-20240415v1.mp3"
691915245,"Why the O.J. Simpson trial still matters","https://news-assets.apple.com/podcast/audio/b6ee50fe-a7c7-4f87-d19b-dc3f61d6a31d/ANT-20240412v1.mp3"
691598263,"What the judge will ask jurors in Trump hush-money case","https://news-assets.apple.com/podcast/audio/a91db075-6177-4fb8-e8b5-d33494a6bc19/ANT-20240411v1.mp3"
691229346,"Delayed student financial aid leaves millions in limbo","https://news-assets.apple.com/podcast/audio/07831feb-9ffc-47bc-b5fb-f92c9fda5eb3/ANT-20240410v1.mp3"
690892785,"Why more Americans are moving back in with family","https://news-assets.apple.com/podcast/audio/031c2ac3-b795-4968-ca1a-16d6db183dfa/ANT-20240409v4.mp3"
690554998,"Eclipse day is here. Here’s how to prepare.","https://news-assets.apple.com/podcast/audio/7e88f8d4-ce43-49ef-ed53-f90f96bc816d/ANT-20240408v2.mp3"
689576475,"The new magic number for retirement planning, and how to see the eclipse","https://news-assets.apple.com/podcast/audio/c520e188-b354-40a0-ec2f-6bfe59d6444c/ANT-20240405v4.mp3"
689100774,"America bet big on sports gambling. The backlash is here.","https://news-assets.apple.com/podcast/audio/07255c28-760d-43ff-9d26-5bb851cf8172/ANT-20240404v2.mp3"
688648436,"José Andrés on aid-worker killings and Gaza’s food crisis","https://news-assets.apple.com/podcast/audio/17b10629-72e5-4b19-d2fb-f5eb5e94212d/ANT-20240403v1.mp3"
688227130,"Birth-control misinformation is rampant online, doctors say","https://news-assets.apple.com/podcast/audio/a8d4c008-1874-43f6-a15b-6d338d09ff9f/ANT-20240402v1.mp3"
687830513,"Protesters in Israel demand Netanyahu’s resignation","https://news-assets.apple.com/podcast/audio/78c34cb9-3064-40b5-a350-b4a7d8c1326f/ANT-20240401v2.mp3"
686916576,"Why more schools are banning cellphones","https://news-assets.apple.com/podcast/audio/8936e5e4-5c51-4581-84bb-ffe82c52e15f/ANT-20240329v1.mp3"
686570289,"Stories of the victims of the Baltimore bridge collapse","https://news-assets.apple.com/podcast/audio/4c3508a1-a4d7-4b90-c581-1dfd7bc095a5/ANT-20240328v1.mp3"
686269139,"What’s next after the deadly Baltimore bridge collapse","https://news-assets.apple.com/podcast/audio/441aa7b1-b94f-4e10-e5bf-e1085a42e782/ANT-20240327v1.mp3"
685978800,"The Supreme Court case that could limit abortion pills","https://news-assets.apple.com/podcast/audio/397b8193-cc6d-4d37-e360-1a0f67da7737/ANT-20240326v3.mp3"
685643743,"How the deadly terror attack in Russia exposes Putin","https://news-assets.apple.com/podcast/audio/53aadc29-af13-4d9d-ef4d-63371d33c656/ANT-20240325v2.mp3"
684781858,"What you need to know about big changes to real estate","https://news-assets.apple.com/podcast/audio/49cc5095-f161-43ad-9f8c-2290248f75d4/ANT-20240322v2.mp3"
684337366,"Trump’s legal and money troubles come to a head","https://news-assets.apple.com/podcast/audio/c8bea571-f89e-465e-f64c-d97d1af11f07/ANT-20240321v3.mp3"
683976383,"Former Nickelodeon stars discuss abuse allegations","https://news-assets.apple.com/podcast/audio/e0c1e11b-1055-43d1-d295-204288105cf5/ANT-20240320v1.mp3"
683635976,"How third-party candidates might upend the presidential race","https://news-assets.apple.com/podcast/audio/bb3a86ea-6618-4605-d3cd-e2a0558c68ff/ANT-20240319v2.mp3"
683393270,"The police officers accused of child sexual abuse","https://news-assets.apple.com/podcast/audio/a5886f59-cfc9-48d4-f89b-e12b681623a3/ANT-20240318v2.mp3"
682736646,"What to know about the death of a Boeing whistleblower","https://news-assets.apple.com/podcast/audio/e120772e-85f2-4458-c09d-d2f41754614d/ANT-20240315v4.mp3"
682396666,"Biden vowed to cut drug prices. Big Pharma is fighting back.","https://news-assets.apple.com/podcast/audio/1c721ff4-52ae-4a0c-da55-4998223b7376/ANT-20240314v3.mp3"
682100056,"The U.S. bill giving TikTok an ultimatum","https://news-assets.apple.com/podcast/audio/a146265a-d6b9-4219-d81d-6cc0ac3e3b51/ANT-20240313v3.mp3"
681801017,"The struggle to reunite families separated under Trump","https://news-assets.apple.com/podcast/audio/7b64a69d-2cfb-4d1b-fc12-8d81afa7bbdf/ANT-20240312v2.mp3"
681506425,"Netanyahu’s plan to invade Rafah: “We’re not going to leave”","https://news-assets.apple.com/podcast/audio/6bec075f-c390-426e-8cd4-56548a8307bc/ANT-20240311v3.mp3"
680801262,"What to know about last night’s State of the Union address","https://news-assets.apple.com/podcast/audio/ab0b3187-ea2b-4226-bbd5-08527303d410/ANT-20240408v5.mp3"
680486277,"Wildfires have devastated Texas’s cattle industry","https://news-assets.apple.com/podcast/audio/983307eb-4c65-4be5-f75d-76c0591d9768/ANT-20240307v2.mp3"
680207959,"Nikki Haley’s campaign exit sets up a Biden-Trump rematch","https://news-assets.apple.com/podcast/audio/ff01df7f-27ed-4db8-d970-3b60f708ff4e/ANT-20240306-v3.mp3"
679914066,"What to watch on Super Tuesday","https://news-assets.apple.com/podcast/audio/4d10b256-5310-4838-81ab-11dbac546269/ANT-20240305-v2.mp3"
679646790,"The U.S. push for a temporary cease-fire in Gaza","https://news-assets.apple.com/podcast/audio/c493ae07-c298-41ba-e8b6-a43b37e8b686/ANT-20240304v7.mp3"
678946422,"What we know about Palestinians killed near aid trucks","https://news-assets.apple.com/podcast/audio/e78a244a-02e0-4f18-a0f5-7bacb8a8471a/ANT-20240301v2.mp3"
678350087,"Republicans scramble as backlash over IVF ruling continues","https://news-assets.apple.com/podcast/audio/5bd08d31-e164-4361-8f25-59a3cf2c3ce1/ANT-20240229v1.mp3"
677977691,"What counts as a machine gun? Supreme Court hears case.","https://news-assets.apple.com/podcast/audio/a5d4d06d-5dd8-4fcd-dfc8-ef91e8791de5/ANT-20240228v1.mp3"
677568630,"Arab Americans challenge Biden’s Gaza response in primary","https://news-assets.apple.com/podcast/audio/1c9a16d1-9abb-4ef8-a764-c70b9f8790d8/ANT-20240227v2.mp3"
676488506,"How asylum-seeking migrants got stuck living at O’Hare","https://news-assets.apple.com/podcast/audio/5f0204d7-8d6f-48eb-b32d-3a2518a6c993/ANT-20240226v2.mp3"
675653907,"What to know as the war in Ukraine enters its third year","https://news-assets.apple.com/podcast/audio/f1839a65-bef4-4e1f-b651-ad57af380d9b/ANT-20240223v1.mp3"
675285361,"The national-security threat lurking at U.S. ports","https://news-assets.apple.com/podcast/audio/23f0cba5-b77c-4576-ce33-af11cc88c0a0/ANT-20240222v1.mp3"
674955401,"What’s next for IVF after a controversial legal ruling","https://news-assets.apple.com/podcast/audio/c9f293e5-4186-4d96-9a16-2ec2f37810fb/ANT-20240221v2.mp3"
674622711,"Life under Tennessee’s strict abortion law","https://news-assets.apple.com/podcast/audio/35f75582-ad1c-40c9-ef27-b2c589b5e415/ANT-20240220v1.mp3"
674337254,"Alexey Navalny is dead. What’s next for Russia?","https://news-assets.apple.com/podcast/audio/78436686-6ca5-4fb2-cc13-fdc0ff40c165/ANT-20240219v1.mp3"
673620915,"Parents of gun-violence victims use AI to push for change","https://news-assets.apple.com/podcast/audio/8ee77fa8-6ce6-4adc-9d30-2b047d2e6c7f/ANT-20240216v4.mp3"
673311194,"A date has been set for Trump's first criminal trial","https://news-assets.apple.com/podcast/audio/42c80874-b744-4443-b43f-f2c13ec1fbcd/ANT-20240215v4.mp3"
672977704,"Financial-aid issues leave colleges and students in limbo","https://news-assets.apple.com/podcast/audio/8c9bc47e-01ba-42bf-e78a-f2e6d6fee168/ANT-20240214v1.mp3"
672664925,"The race to replace George Santos","https://news-assets.apple.com/podcast/audio/49fab8c6-fb97-457d-8cfb-754844400b08/ANT-20240213v2.mp3"
672367341,"Terrified civilians in Rafah await Israel’s ground invasion","https://news-assets.apple.com/podcast/audio/1dfed5da-55f3-4616-c544-7534cd541254/ANT-20240212v1.mp3"
671598797,"The American city calling for migrants to move in","https://news-assets.apple.com/podcast/audio/ba3e38b6-7832-4bf4-e288-7a6eb64ce6d8/ANT-20240209v2.mp3"
671261583,"Inside the court case that could knock Trump off the ballot","https://news-assets.apple.com/podcast/audio/d5d3eb8e-f139-428a-aaaf-6f681a191909/ANT-20240208v3.mp3"
670915460,"A landmark conviction for a school shooter’s mother","https://news-assets.apple.com/podcast/audio/9039ade2-04b8-4b69-ad37-92359342413e/ANT-20240207v1.mp3"
670619271,"The reasons why your groceries are still so expensive","https://news-assets.apple.com/podcast/audio/2a877dda-834f-4e46-de15-f919974b37c6/ANT-20240406v2.mp3"
670281684,"How the IRS is going after billionaires dodging taxes","https://news-assets.apple.com/podcast/audio/1c50f4ac-0639-43c6-f41e-d4dbc62cd2fb/ANT-20240205v2.mp3"
669673595,"What South Carolina can tell us about Biden’s 2024 chances","https://news-assets.apple.com/podcast/audio/91d19310-aefe-4124-c54f-1a809c48a02a/ANT-20240202v5.mp3"
669344071,"At Senate hearing, tech CEOs grilled over protecting kids","https://news-assets.apple.com/podcast/audio/4a7f0a89-c112-4773-becf-480d8fece37d/ANT-20240201v2.mp3"
669032325,"How Trump’s legal woes are threatening his fortune","https://news-assets.apple.com/podcast/audio/df86b8c5-6373-4975-a628-a7838a1bfde6/ANT-20240131v3.mp3"
668814996,"Middle East problems pile up for Biden","https://news-assets.apple.com/podcast/audio/1f734dbb-5917-4046-ff0e-c36f86d60366/ANT-20240130v3.mp3"
668520006,"Inside the deadly conditions for children in Gaza","https://news-assets.apple.com/podcast/audio/3c8aaa2c-24de-4129-e470-1b335cd537ca/ANT-20240129v3.mp3"
667899156,"U.N. court declines to order cease-fire in Israel-Hamas war","https://news-assets.apple.com/podcast/audio/3415473f-0b6f-41b0-e887-80572db69d65/ANT-20240126v2.mp3"
667596648,"The FAA’s good news and bad news for Boeing","https://news-assets.apple.com/podcast/audio/2881e2a8-0552-4872-a09c-e2d94847de61/ANT-20240125v3.mp3"
667278977,"Trump beat Haley in New Hampshire. What happens now?","https://news-assets.apple.com/podcast/audio/51f251dd-d473-4192-e87d-79ee10a25be3/ANT-20240124v3.mp3"
666968247,"Why this year’s Democratic race in New Hampshire is so weird","https://news-assets.apple.com/podcast/audio/997c122d-8b13-4a19-d049-1eff7e462dae/ANT-20240123v4.mp3"
666720283,"Why Trump’s new campaign playbook is so effective","https://news-assets.apple.com/podcast/audio/c177c320-fcfb-4bac-f978-e361b6810e3a/ANT-20240122v2.mp3"
665994048,"He survived one execution. He’s fighting to avoid another.","https://news-assets.apple.com/podcast/audio/e3e98001-24a3-4dca-d7ae-62f19b3652c2/ANT-20240119v1.mp3"
665641123,"What’s next for Boeing after series of setbacks","https://news-assets.apple.com/podcast/audio/1629fd5c-103c-4826-d11c-79fc73f5c495/ANT-20240118v4.mp3"
665335323,"Gaza families are starving. Aid agencies want action.","https://news-assets.apple.com/podcast/audio/d4d13642-fb3c-4102-c389-3b48ce5ebe9b/ANT-20240117v2.mp3"
665103377,"Trump won Iowa in a landslide. What happens next?","https://news-assets.apple.com/podcast/audio/88357f53-7307-45dd-cbc1-ef6de78da8e9/ANT-20240116v2.mp3"
664874607,"What to watch in the Iowa caucuses","https://news-assets.apple.com/podcast/audio/57e759d5-aafb-4682-e376-41418b830ee4/ANT-20240115v1.mp3"
664181886,"Why a U.S.-led coalition launched new airstrikes on Yemen","https://news-assets.apple.com/podcast/audio/41824c75-f439-4600-f22b-487bc88c48e5/ANT-20240112v1.mp3"
663901122,"Understanding South Africa’s genocide case against Israel","https://news-assets.apple.com/podcast/audio/de9dda99-f1e9-4ebd-fbf4-c4483e91d0d7/ANT-20240111v2.mp3"
663622417,"Inside the aviation industry’s rough start to 2024","https://news-assets.apple.com/podcast/audio/5e9370ac-98fe-470e-ec43-ec8b2da0b6ec/ANT-20240110v1.mp3"
663360218,"How the U.S. is trying to keep the Gaza war from spreading","https://news-assets.apple.com/podcast/audio/c4791033-503c-4966-92ae-99f2102f90af/ANT-20240109v2.mp3"
663154827,"New evidence found in Alaska Airlines flight investigation","https://news-assets.apple.com/podcast/audio/c3829651-3110-4cd0-c1e3-5e39f0650531/ANT-20240108v2.mp3"
662497553,"How Republicans and Democrats see Jan. 6 differently","https://news-assets.apple.com/podcast/audio/8acea6f2-e986-4db3-efec-15cce8f05e2a/ANT-20240105v2.mp3"
662201968,"New fears of famine in Gaza as war rages","https://news-assets.apple.com/podcast/audio/d69d08bc-c0a1-41e8-fbf2-b76e5abb62ff/ANT-20240104v1.mp3"
661934731,"Survivor stories from the heroic Japan Airlines evacuation","https://news-assets.apple.com/podcast/audio/9d64cb03-7622-4703-f7b8-5f8299d04a38/ANT-20240103v2.mp3"
661693388,"The Trump campaign faces its first real test","https://news-assets.apple.com/podcast/audio/f3ad14fe-4774-43f2-984c-fcdfd908633e/ANT-20240102v3.mp3"
659213016,"The U.S. economy is weird, but not in a bad way","https://news-assets.apple.com/podcast/audio/e33e3163-868e-4837-b9ba-779394eec267/ANT-20231222v2.mp3"
658868938,"Christians in Bethlehem cancel festivities as Gaza war rages","https://news-assets.apple.com/podcast/audio/d3e7af78-503d-424e-f751-cb4589c7ff67/ANT-20231221v2.mp3"
658482550,"Why a Colorado court is blocking Trump from the ballot","https://news-assets.apple.com/podcast/audio/9204ccec-66b5-4efd-9697-da198bd76dc6/ANT-20231220v2.mp3"
658109003,"Israel’s using AI to find Gaza targets. Experts are worried.","https://news-assets.apple.com/podcast/audio/3957cba2-8504-4391-aec1-8eef93b16738/ANT-20231219v1.mp3"
657705577,"Hostage deaths put new pressure on Netanyahu","https://news-assets.apple.com/podcast/audio/a22a53f0-c876-4b4e-8c17-8f55a1148d12/ANT-20231218v1.mp3"
656837398,"Biden under fire over unconditional aid to Israel","https://news-assets.apple.com/podcast/audio/e88b8e15-6882-4618-9643-aadd2e19bb1b/ANT-20231215v1.mp3"
656444580,"Hunger pushes Palestinians trapped in Gaza to the brink","https://news-assets.apple.com/podcast/audio/a41e12c3-da67-412c-ab0d-3b1b0e61415e/ANT-20231214v1.mp3"
656083825,"Why critics say the new global climate deal falls short","https://news-assets.apple.com/podcast/audio/42aead3b-41de-4ea9-bd09-09f1543577bf/ANT-20231213v2.mp3"
655724014,"What to know about a week of high-stakes abortion cases","https://news-assets.apple.com/podcast/audio/71105366-b293-48d0-db84-038276c39e65/ANT-20231212-v3.mp3"
655439990,"Examining U.S. rhetoric and actions over the war in Gaza","https://news-assets.apple.com/podcast/audio/a2eb7092-aace-46ce-e64a-ea6e4573f3e4/ANT-20231211v3.mp3"
654795186,"Young activists on what they want from the climate summit","https://news-assets.apple.com/podcast/audio/57e66606-6f49-4038-eac1-1a213e81f2f8/ANT-20231208v2.mp3"
